{
  "candidate_ledger": [
    {
      "access_class": "METADATA_ONLY",
      "attribution_status": "UNREVIEWED",
      "blind_treatment_id": "BLIND-S-ACTIVE-LINEAGE-A1",
      "case_id": "S-ACTIVE-LINEAGE",
      "content_hash": null,
      "content_locator": null,
      "deduplication_key": "doi:10.4135/9781526479563",
      "identity_status": "NOT_CITED",
      "locator": "https://doi.org/10.4135/9781526479563",
      "resolved_id": null,
      "rights_state": "METADATA_ONLY",
      "source_candidate_id": "CR-4fb7714d8d56",
      "status": "METADATA_SCREENED",
      "title": "Communicating at Cultural Crossroads: Utah Asphalt in China"
    },
    {
      "access_class": "METADATA_ONLY",
      "attribution_status": "UNREVIEWED",
      "blind_treatment_id": "BLIND-S-ACTIVE-LINEAGE-A1",
      "case_id": "S-ACTIVE-LINEAGE",
      "content_hash": null,
      "content_locator": null,
      "deduplication_key": "doi:10.34191/ofr-8",
      "identity_status": "NOT_CITED",
      "locator": "https://doi.org/10.34191/ofr-8",
      "resolved_id": null,
      "rights_state": "METADATA_ONLY",
      "source_candidate_id": "CR-54e4834c7c34",
      "status": "METADATA_SCREENED",
      "title": "Geophysical report : Reflection seismograph of the Asphalt Ridge prospect, Uintah County, Utah"
    },
    {
      "access_class": "METADATA_ONLY",
      "attribution_status": "UNREVIEWED",
      "blind_treatment_id": "BLIND-S-ACTIVE-LINEAGE-A1",
      "case_id": "S-ACTIVE-LINEAGE",
      "content_hash": null,
      "content_locator": null,
      "deduplication_key": "doi:10.34191/m-86",
      "identity_status": "NOT_CITED",
      "locator": "https://doi.org/10.34191/m-86",
      "resolved_id": null,
      "rights_state": "METADATA_ONLY",
      "source_candidate_id": "CR-7447ef119a7d",
      "status": "METADATA_SCREENED",
      "title": "Geologic thesis map index of Utah"
    },
    {
      "access_class": "METADATA_ONLY",
      "attribution_status": "UNREVIEWED",
      "blind_treatment_id": "BLIND-S-ACTIVE-LINEAGE-A1",
      "case_id": "S-ACTIVE-LINEAGE",
      "content_hash": null,
      "content_locator": null,
      "deduplication_key": "doi:10.3403/00172928u",
      "identity_status": "NOT_CITED",
      "locator": "https://doi.org/10.3403/00172928u",
      "resolved_id": null,
      "rights_state": "METADATA_ONLY",
      "source_candidate_id": "CR-820a7e2d0d74",
      "status": "METADATA_SCREENED",
      "title": "Quicklime, hydrated lime and natural calcium carbonate"
    },
    {
      "access_class": "METADATA_ONLY",
      "attribution_status": "UNREVIEWED",
      "blind_treatment_id": "BLIND-S-ACTIVE-LINEAGE-A1",
      "case_id": "S-ACTIVE-LINEAGE",
      "content_hash": null,
      "content_locator": null,
      "deduplication_key": "doi:10.34191/m-7",
      "identity_status": "NOT_CITED",
      "locator": "https://doi.org/10.34191/m-7",
      "resolved_id": null,
      "rights_state": "METADATA_ONLY",
      "source_candidate_id": "CR-b27519feeb64",
      "status": "METADATA_SCREENED",
      "title": "Index to unpublished geologic thesis mapping in Utah"
    },
    {
      "access_class": "METADATA_ONLY",
      "attribution_status": "UNREVIEWED",
      "blind_treatment_id": "BLIND-S-ACTIVE-LINEAGE-A1",
      "case_id": "S-ACTIVE-LINEAGE",
      "content_hash": null,
      "content_locator": null,
      "deduplication_key": "doi:10.4135/9781526479556",
      "identity_status": "NOT_CITED",
      "locator": "https://doi.org/10.4135/9781526479556",
      "resolved_id": null,
      "rights_state": "METADATA_ONLY",
      "source_candidate_id": "CR-db424b233a91",
      "status": "METADATA_SCREENED",
      "title": "Caught at the Crossroads of Culture: Utah Asphalt in China"
    },
    {
      "access_class": "METADATA_ONLY",
      "attribution_status": "UNREVIEWED",
      "blind_treatment_id": "BLIND-S-ACTIVE-LINEAGE-A1",
      "case_id": "S-ACTIVE-LINEAGE",
      "content_hash": null,
      "content_locator": null,
      "deduplication_key": "doi:10.34191/ss-19",
      "identity_status": "NOT_CITED",
      "locator": "https://doi.org/10.34191/ss-19",
      "resolved_id": null,
      "rights_state": "METADATA_ONLY",
      "source_candidate_id": "CR-fe4f9a189356",
      "status": "METADATA_SCREENED",
      "title": "Bituminous sandstone deposits asphalt ridge, Uintah County, Utah"
    },
    {
      "access_class": "METADATA_ONLY",
      "attribution_status": "UNREVIEWED",
      "blind_treatment_id": "BLIND-S-ACTIVE-LINEAGE-A1",
      "case_id": "S-ACTIVE-LINEAGE",
      "content_hash": null,
      "content_locator": null,
      "deduplication_key": "doi:10.2307/45058529",
      "identity_status": "NOT_CITED",
      "locator": "https://doi.org/10.2307/45058529",
      "resolved_id": null,
      "rights_state": "METADATA_ONLY",
      "source_candidate_id": "CR-ff94dc700477",
      "status": "METADATA_SCREENED",
      "title": "<i>THE TURNER THESIS and MORMON BEGINNINGS in NEW YORK and UTAH</i>"
    },
    {
      "access_class": "METADATA_ONLY",
      "attribution_status": "UNREVIEWED",
      "blind_treatment_id": "BLIND-S-ACTIVE-LINEAGE-A1",
      "case_id": "S-ACTIVE-LINEAGE",
      "content_hash": null,
      "content_locator": null,
      "deduplication_key": "doi:10.15368/theses.2009.149",
      "identity_status": "NOT_CITED",
      "locator": "https://api.openalex.org/works/W153244468",
      "resolved_id": null,
      "rights_state": "METADATA_ONLY",
      "source_candidate_id": "OA-W153244468",
      "status": "METADATA_SCREENED",
      "title": "Analysis of Stabilized Adobe in Rural East Africa"
    },
    {
      "access_class": "METADATA_ONLY",
      "attribution_status": "UNREVIEWED",
      "blind_treatment_id": "BLIND-S-ACTIVE-LINEAGE-A1",
      "case_id": "S-ACTIVE-LINEAGE",
      "content_hash": null,
      "content_locator": null,
      "deduplication_key": "openalex:w1956400912",
      "identity_status": "IDENTITY_UNRESOLVED",
      "locator": "https://api.openalex.org/works/W1956400912",
      "resolved_id": null,
      "rights_state": "METADATA_ONLY",
      "source_candidate_id": "OA-W1956400912",
      "status": "METADATA_SCREENED",
      "title": "Nano-scale evaluation of moisture damage in asphalt"
    },
    {
      "access_class": "METADATA_ONLY",
      "attribution_status": "UNREVIEWED",
      "blind_treatment_id": "BLIND-S-ACTIVE-LINEAGE-A1",
      "case_id": "S-ACTIVE-LINEAGE",
      "content_hash": null,
      "content_locator": null,
      "deduplication_key": "doi:10.1016/j.conbuildmat.2011.04.072",
      "identity_status": "NOT_CITED",
      "locator": "https://api.openalex.org/works/W2017822498",
      "resolved_id": null,
      "rights_state": "METADATA_ONLY",
      "source_candidate_id": "OA-W2017822498",
      "status": "METADATA_SCREENED",
      "title": "Effects of using asphaltite as filler on mechanical properties of hot mix asphalt"
    },
    {
      "access_class": "METADATA_ONLY",
      "attribution_status": "UNREVIEWED",
      "blind_treatment_id": "BLIND-S-ACTIVE-LINEAGE-A1",
      "case_id": "S-ACTIVE-LINEAGE",
      "content_hash": null,
      "content_locator": null,
      "deduplication_key": "openalex:w2308050459",
      "identity_status": "NOT_CITED",
      "locator": "https://api.openalex.org/works/W2308050459",
      "resolved_id": null,
      "rights_state": "METADATA_ONLY",
      "source_candidate_id": "OA-W2308050459",
      "status": "METADATA_SCREENED",
      "title": "An integrated approach to predict ettringite formation in sulfate soils and identifying sulfate damage along SH 130"
    },
    {
      "access_class": "METADATA_ONLY",
      "attribution_status": "UNREVIEWED",
      "blind_treatment_id": "BLIND-S-ACTIVE-LINEAGE-A1",
      "case_id": "S-ACTIVE-LINEAGE",
      "content_hash": null,
      "content_locator": null,
      "deduplication_key": "openalex:w2765648563",
      "identity_status": "NOT_CITED",
      "locator": "https://api.openalex.org/works/W2765648563",
      "resolved_id": null,
      "rights_state": "METADATA_ONLY",
      "source_candidate_id": "OA-W2765648563",
      "status": "METADATA_SCREENED",
      "title": "Evaluating the Mechanical Properties and Long-Term Performance of Stabilized Full-Depth Reclamation Base Materials"
    },
    {
      "access_class": "METADATA_ONLY",
      "attribution_status": "UNREVIEWED",
      "blind_treatment_id": "BLIND-S-ACTIVE-LINEAGE-A1",
      "case_id": "S-ACTIVE-LINEAGE",
      "content_hash": null,
      "content_locator": null,
      "deduplication_key": "doi:10.3390/app8071029",
      "identity_status": "NOT_CITED",
      "locator": "https://api.openalex.org/works/W2811214086",
      "resolved_id": null,
      "rights_state": "METADATA_ONLY",
      "source_candidate_id": "OA-W2811214086",
      "status": "METADATA_SCREENED",
      "title": "Effects of Titanate Coupling Agent on Engineering Properties of Asphalt Binders and Mixtures Incorporating LLDPE-CaCO3 Pellet"
    },
    {
      "access_class": "METADATA_ONLY",
      "attribution_status": "UNREVIEWED",
      "blind_treatment_id": "BLIND-S-ACTIVE-LINEAGE-A1",
      "case_id": "S-ACTIVE-LINEAGE",
      "content_hash": null,
      "content_locator": null,
      "deduplication_key": "openalex:w2920973764",
      "identity_status": "IDENTITY_UNRESOLVED",
      "locator": "https://api.openalex.org/works/W2920973764",
      "resolved_id": null,
      "rights_state": "METADATA_ONLY",
      "source_candidate_id": "OA-W2920973764",
      "status": "METADATA_SCREENED",
      "title": "Investigation into ageing and the effect of hydrated lime on mastics and mixture ageing"
    },
    {
      "access_class": "METADATA_ONLY",
      "attribution_status": "UNREVIEWED",
      "blind_treatment_id": "BLIND-S-ACTIVE-LINEAGE-A1",
      "case_id": "S-ACTIVE-LINEAGE",
      "content_hash": null,
      "content_locator": null,
      "deduplication_key": "openalex:w2951241171",
      "identity_status": "NOT_CITED",
      "locator": "https://api.openalex.org/works/W2951241171",